{"state":"complete","resolved":[{"siteId":"src/index.ts:3:1#resolved","roles":["reference","export","barrel"]},{"siteId":"src/query.ts:135:17#resolved","roles":["reference","read","call","export"]},{"siteId":"src/query.ts:94:17#resolved","roles":["declaration","reference","export"]}],"unresolved":[],"reasoning":"The repository snapshot resolves the exported declaration, its internal call reference, and the module barrel re-export; no requested structural boundary remains unresolved."}
