{"state":"complete","resolved":[{"siteId":"src/index.ts:3:1#resolved","roles":["reference","export","barrel"]},{"siteId":"src/query.ts:135:17#resolved","roles":["reference","read","call","export"]},{"siteId":"src/query.ts:94:17#resolved","roles":["declaration","reference","export"]}],"unresolved":[],"reasoning":"The integrity-bound artifact reports complete structural impact: the barrel re-export, the internal call, and the exported declaration all resolve to canonical source sites; no requested boundary is unresolved."}
